{
  "$schema": "https://json-schema.org/draft/2020-12/schema",
  "$id": "https://raw.githubusercontent.com/api-evangelist/postman/main/json-schema/postman-get-api-collection-schema.json",
  "title": "getApiCollection",
  "x-generated": "2026-10-04",
  "x-method": "derived",
  "x-generator": "derive-json-schema.py",
  "x-source": "openapi/postman-apis-api-openapi.yml#/components/schemas/getApiCollection",
  "type": "object",
  "properties": {
    "item": {
      "type": "array",
      "items": {
        "type": "object",
        "additionalProperties": {
          "description": "Any type"
        }
      },
      "description": "A list of the collection's contents."
    },
    "info": {
      "$ref": "#/$defs/GetApiCollectionInfo",
      "description": "Information about the collection."
    },
    "auth": {
      "type": "object",
      "additionalProperties": {
        "description": "Any type"
      },
      "description": "The collection's auth information. For a complete list of values, refer to the **Auth** entry in the [Postman Collection Format documentation](https://schema.postman.com/collection/json/v2.1.0/draft-07/docs/index.html)."
    },
    "variable": {
      "type": "array",
      "items": {
        "type": "object",
        "additionalProperties": {
          "description": "Any type"
        }
      },
      "description": "A list of the collection's variables."
    }
  },
  "$defs": {
    "GetApiCollectionInfo": {
      "type": "object",
      "properties": {
        "name": {
          "type": "string",
          "description": "The collection's name."
        },
        "schema": {
          "type": "string",
          "format": "url",
          "description": "A URL to the collection's schema."
        },
        "_postman_id": {
          "type": "string",
          "description": "The collection's Postman ID."
        },
        "description": {
          "type": "string",
          "description": "The collection's description."
        }
      },
      "description": "Information about the collection.",
      "title": "GetApiCollectionInfo"
    }
  }
}