{
  "info": {
    "_postman_id": "b38ffb38-bcf6-4c0c-9159-8ae78528b9d2",
    "name": "Postman Mock Servers API",
    "description": "The Postman Mock Servers API enables you to create and manage mock servers\nthat simulate API behavior. Mock servers generate responses based on examples\nsaved in your Postman collections, allowing frontend and backend teams to\nwork in parallel during API development.\n\n## Authentication\nAll requests require an API key passed in the `x-api-key` header.\n\n## Rate Limits\nMock server calls have separate usage limits based on your Postman plan.\nFree plans include 1,000 mock server calls per month.\n\n\nContact Support:\n Name: Postman Developer Support\n Email: help@postman.com",
    "schema": "https://schema.getpostman.com/json/collection/v2.1.0/collection.json",
    "createdAt": "2026-06-05T13:04:47.000Z",
    "updatedAt": "2026-06-05T13:04:47.000Z",
    "lastUpdatedBy": "35240",
    "uid": "35240-b38ffb38-bcf6-4c0c-9159-8ae78528b9d2"
  },
  "item": [
    {
      "name": "mocks",
      "item": [
        {
          "name": "{mockId}",
          "item": [
            {
              "name": "publish",
              "item": [
                {
                  "name": "Postman Publish a mock server",
                  "id": "19664cd5-6227-486f-ab74-1627dd1afbc2",
                  "protocolProfileBehavior": {
                    "disableBodyPruning": true
                  },
                  "request": {
                    "method": "POST",
                    "header": [
                      {
                        "key": "Accept",
                        "value": "application/json"
                      }
                    ],
                    "url": {
                      "raw": "{{baseUrl}}/mocks/:mockId/publish",
                      "host": [
                        "{{baseUrl}}"
                      ],
                      "path": [
                        "mocks",
                        ":mockId",
                        "publish"
                      ],
                      "variable": [
                        {
                          "id": "86acbf08-8e1c-49fe-bd38-5b67db0cd9cd",
                          "key": "mockId",
                          "value": "<string>",
                          "description": "(Required) The mock server's unique ID or UID."
                        }
                      ]
                    },
                    "description": "Publishes a mock server, making it publicly accessible without requiring authentication."
                  },
                  "response": [
                    {
                      "id": "18c5fc99-1660-4576-847f-3f662e8e8554",
                      "name": "Successfully published mock server",
                      "originalRequest": {
                        "method": "POST",
                        "header": [
                          {
                            "description": "Added as a part of security scheme: apikey",
                            "key": "x-api-key",
                            "value": "<API Key>"
                          }
                        ],
                        "url": {
                          "raw": "{{baseUrl}}/mocks/:mockId/publish",
                          "host": [
                            "{{baseUrl}}"
                          ],
                          "path": [
                            "mocks",
                            ":mockId",
                            "publish"
                          ],
                          "variable": [
                            {
                              "key": "mockId"
                            }
                          ]
                        }
                      },
                      "status": "OK",
                      "code": 200,
                      "_postman_previewlanguage": "text",
                      "header": [],
                      "cookie": [],
                      "responseTime": null,
                      "body": null,
                      "createdAt": "2026-06-05T13:04:47.000Z",
                      "updatedAt": "2026-06-05T13:04:47.000Z",
                      "uid": "35240-18c5fc99-1660-4576-847f-3f662e8e8554"
                    },
                    {
                      "id": "f5bc220b-418f-4ffe-b07d-04dcfc9e73e1",
                      "name": "Authentication credentials are missing or invalid",
                      "originalRequest": {
                        "method": "POST",
                        "header": [
                          {
                            "key": "Accept",
                            "value": "application/json"
                          },
                          {
                            "description": "Added as a part of security scheme: apikey",
                            "key": "x-api-key",
                            "value": "<API Key>"
                          }
                        ],
                        "url": {
                          "raw": "{{baseUrl}}/mocks/:mockId/publish",
                          "host": [
                            "{{baseUrl}}"
                          ],
                          "path": [
                            "mocks",
                            ":mockId",
                            "publish"
                          ],
                          "variable": [
                            {
                              "key": "mockId"
                            }
                          ]
                        }
                      },
                      "status": "Unauthorized",
                      "code": 401,
                      "_postman_previewlanguage": "json",
                      "header": [
                        {
                          "key": "Content-Type",
                          "value": "application/json"
                        }
                      ],
                      "cookie": [],
                      "responseTime": null,
                      "body": "{\n  \"error\": {\n    \"name\": \"<string>\",\n    \"message\": \"<string>\"\n  }\n}",
                      "createdAt": "2026-06-05T13:04:47.000Z",
                      "updatedAt": "2026-06-05T13:04:47.000Z",
                      "uid": "35240-f5bc220b-418f-4ffe-b07d-04dcfc9e73e1"
                    },
                    {
                      "id": "7c1d576f-346b-493c-8bef-5e22676574e5",
                      "name": "The requested resource was not found",
                      "originalRequest": {
                        "method": "POST",
                        "header": [
                          {
                            "key": "Accept",
                            "value": "application/json"
                          },
                          {
                            "description": "Added as a part of security scheme: apikey",
                            "key": "x-api-key",
                            "value": "<API Key>"
                          }
                        ],
                        "url": {
                          "raw": "{{baseUrl}}/mocks/:mockId/publish",
                          "host": [
                            "{{baseUrl}}"
                          ],
                          "path": [
                            "mocks",
                            ":mockId",
                            "publish"
                          ],
                          "variable": [
                            {
                              "key": "mockId"
                            }
                          ]
                        }
                      },
                      "status": "Not Found",
                      "code": 404,
                      "_postman_previewlanguage": "json",
                      "header": [
                        {
                          "key": "Content-Type",
                          "value": "application/json"
                        }
                      ],
                      "cookie": [],
                      "responseTime": null,
                      "body": "{\n  \"error\": {\n    \"name\": \"<string>\",\n    \"message\": \"<string>\"\n  }\n}",
                      "createdAt": "2026-06-05T13:04:47.000Z",
                      "updatedAt": "2026-06-05T13:04:47.000Z",
                      "uid": "35240-7c1d576f-346b-493c-8bef-5e22676574e5"
                    },
                    {
                      "id": "5be6b4c8-1713-45ae-840f-a06419fe31b2",
                      "name": "Too many requests - rate limit exceeded",
                      "originalRequest": {
                        "method": "POST",
                        "header": [
                          {
                            "key": "Accept",
                            "value": "application/json"
                          },
                          {
                            "description": "Added as a part of security scheme: apikey",
                            "key": "x-api-key",
                            "value": "<API Key>"
                          }
                        ],
                        "url": {
                          "raw": "{{baseUrl}}/mocks/:mockId/publish",
                          "host": [
                            "{{baseUrl}}"
                          ],
                          "path": [
                            "mocks",
                            ":mockId",
                            "publish"
                          ],
                          "variable": [
                            {
                              "key": "mockId"
                            }
                          ]
                        }
                      },
                      "status": "Too Many Requests",
                      "code": 429,
                      "_postman_previewlanguage": "json",
                      "header": [